{
  "eventId": "01J6ZK7Q3W8K0M2N4P6R8T0V5A",
  "eventType": "TransactionDecisionExecutionCompleted",
  "eventVersion": 1,
  "occurredAt": "2026-07-20T15:31:00Z",
  "publishedAt": "2026-07-20T15:31:01Z",
  "producer": "pld-transaction-screening",
  "correlationId": "01J6ZK7Q3W8K0M2N4P6R8T0V2B",
  "causationId": "01J6ZK7Q3W8K0M2N4P6R8T0V4A",
  "actor": {
    "type": "SYSTEM",
    "id": "rule-engine"
  },
  "subject": {
    "partyId": "pty_01J6ZK7Q3W8K0M2N4P6R8T0V2D",
    "accountId": "acc_01J6ZK7Q3W8K0M2N4P6R8T0V2E",
    "analysisCycleId": null,
    "caseId": null
  },
  "dataClassification": "CONFIDENTIAL",
  "payload": {
    "commandId": "cmd_01J6ZK7Q3W8K0M2N4P6R8T0V5B",
    "evaluationId": "evl_01J6ZK7Q3W8K0M2N4P6R8T0V2G",
    "transactionId": "txn_01J6ZK7Q3W8K0M2N4P6R8T0V2H",
    "actionType": "HOLD_TRANSACTION",
    "status": "APPLIED"
  }
}
