{
  "eventId": "01J6ZK7Q3W8K0M2N4P6R8T0V2A",
  "eventType": "TransactionSignalDetected",
  "eventVersion": 1,
  "occurredAt": "2026-07-20T15:30:00Z",
  "publishedAt": "2026-07-20T15:30:01Z",
  "producer": "pld-transaction-screening",
  "correlationId": "01J6ZK7Q3W8K0M2N4P6R8T0V2B",
  "causationId": "01J6ZK7Q3W8K0M2N4P6R8T0V2C",
  "actor": {
    "type": "SYSTEM",
    "id": "rule-engine"
  },
  "subject": {
    "partyId": "pty_01J6ZK7Q3W8K0M2N4P6R8T0V2D",
    "accountId": "acc_01J6ZK7Q3W8K0M2N4P6R8T0V2E",
    "analysisCycleId": null,
    "caseId": null
  },
  "dataClassification": "CONFIDENTIAL",
  "payload": {
    "signalId": "sig_01J6ZK7Q3W8K0M2N4P6R8T0V2F",
    "evaluationId": "evl_01J6ZK7Q3W8K0M2N4P6R8T0V2G",
    "transactionId": "txn_01J6ZK7Q3W8K0M2N4P6R8T0V2H",
    "signalType": "RULE_MATCH",
    "severity": "HIGH",
    "ruleMatches": [
      {
        "ruleCode": "PIX-009",
        "ruleVersion": 4,
        "explanationCode": "AMOUNT_OUTSIDE_PROFILE"
      }
    ],
    "riskProfileVersion": 7,
    "recommendedRoute": "DERIVED_TO_ANALYST"
  }
}
