{
  "eventId": "01J6ZK7Q3W8K0M2N4P6R8T0V4A",
  "eventType": "TransactionEvaluationCompleted",
  "eventVersion": 1,
  "occurredAt": "2026-07-20T15:30:00Z",
  "publishedAt": "2026-07-20T15:30:01Z",
  "producer": "pld-transaction-screening",
  "correlationId": "01J6ZK7Q3W8K0M2N4P6R8T0V2B",
  "causationId": "01J6ZK7Q3W8K0M2N4P6R8T0V4B",
  "actor": {
    "type": "SYSTEM",
    "id": "rule-engine"
  },
  "subject": {
    "partyId": "pty_01J6ZK7Q3W8K0M2N4P6R8T0V2D",
    "accountId": "acc_01J6ZK7Q3W8K0M2N4P6R8T0V2E",
    "analysisCycleId": null,
    "caseId": null
  },
  "dataClassification": "CONFIDENTIAL",
  "payload": {
    "evaluationId": "evl_01J6ZK7Q3W8K0M2N4P6R8T0V2G",
    "transactionId": "txn_01J6ZK7Q3W8K0M2N4P6R8T0V2H",
    "inputEventVersion": 1,
    "evaluatedAt": "2026-07-20T15:30:00Z",
    "transactionSnapshotRef": "snp_01J6ZK7Q3W8K0M2N4P6R8T0V4C",
    "rulesetVersion": "ruleset-42",
    "riskProfileVersion": 7,
    "rulesExecuted": [
      { "ruleCode": "PIX-001", "ruleVersion": 12 },
      { "ruleCode": "PIX-009", "ruleVersion": 4 }
    ],
    "rulesTriggered": [
      {
        "ruleCode": "PIX-009",
        "ruleVersion": 4,
        "explanationCode": "AMOUNT_OUTSIDE_PROFILE"
      }
    ],
    "factsConsidered": [
      { "code": "expectedMonthlyIncome", "quality": "PRESENT" },
      { "code": "occupation", "quality": "UNKNOWN" }
    ],
    "missingFacts": ["occupation"],
    "technicalOutcome": "SIGNAL_RAISED",
    "explanation": [
      { "code": "AMOUNT_OUTSIDE_PROFILE", "detail": "Valor 8x acima da renda declarada" }
    ],
    "latencyMs": 42,
    "executionStatus": "COMPLETED"
  }
}
