{
  "eventId": "01J6ZK7Q3W8K0M2N4P6R8T0V7A",
  "eventType": "AnalysisCycleStatusChanged",
  "eventVersion": 1,
  "occurredAt": "2026-07-20T15:32:00Z",
  "publishedAt": "2026-07-20T15:32:01Z",
  "producer": "pld-customer-analysis",
  "correlationId": "01J6ZK7Q3W8K0M2N4P6R8T0V2B",
  "causationId": "01J6ZK7Q3W8K0M2N4P6R8T0V3A",
  "actor": {
    "type": "SYSTEM",
    "id": "case-manager"
  },
  "subject": {
    "partyId": "pty_01J6ZK7Q3W8K0M2N4P6R8T0V2D",
    "accountId": "acc_01J6ZK7Q3W8K0M2N4P6R8T0V2E",
    "analysisCycleId": "acy_01J6ZK7Q3W8K0M2N4P6R8T0V7B",
    "caseId": null
  },
  "dataClassification": "CONFIDENTIAL",
  "payload": {
    "analysisCycleId": "acy_01J6ZK7Q3W8K0M2N4P6R8T0V7B",
    "cycleType": "TRANSACTION_ALERT",
    "previousStatus": null,
    "newStatus": "CREATED",
    "reasonCode": "MANUAL_REVIEW_REQUESTED",
    "policyVersion": "customer-risk-12"
  }
}
